1,Cash,For all cash payments. Must be exact change. Do not split a single fee into multiple payments.
2,Check,For checks received at the front counter or through the mail. Do not split a single fee into multiple payments.
3,Credit Card - Counter,For card transactions at the front counter. Do not split a single fee into multiple payments.
4,Credit Card - Online,For online card transactions. Do not split a single fee into multiple payments.
5,Internal Billing,For projects on Yolo County property. Do not split a single fee into multiple payments.
6,Refund,All refunds must be approved by management and fiscal.
